{
  "schema": "simd-lab-result-v1",
  "id": "2026-08-07-baseline-rust-sqerr-best-dispatch-f64",
  "created_at": "2026-08-07T03:28:39Z",
  "provenance": {
    "repository": "PlaneSight/rust-zig-cpp-simd-lab",
    "commit": "ec63b51ecbd9f67b1f93d61f92f40dd1d771df67",
    "branch": "main",
    "workflow_run": null,
    "source_files": [
      "scripts/run_benchmarks.py",
      "rust/src/bin/bench.rs",
      "rust/src/lib.rs"
    ]
  },
  "environment": {
    "os": "Darwin 25.6.0",
    "arch": "arm64",
    "cpu": "arm",
    "cpu_features": [],
    "target": "aarch64-apple-darwin",
    "runner": "local-macos",
    "virtualized": null
  },
  "toolchain": {
    "language": "rust",
    "compiler": "rustc",
    "version": "rustc 1.97.1 (8bab26f4f 2026-07-14)",
    "optimization": "release",
    "flags": [
      "cargo",
      "run",
      "--release",
      "--bin",
      "bench"
    ]
  },
  "experiment": {
    "family": "reductions",
    "kernel": "squared_error",
    "implementation": "runtime-dispatch",
    "variant": "best-dispatch-f64",
    "data_type": "f64",
    "lanes": null,
    "isa": null,
    "semantics": "f64-accumulation",
    "dataset": "deterministic-f32-v1",
    "parameters": {
      "target_tier": "baseline",
      "sample_count": 15,
      "warmup_samples": 3,
      "size_count": 6
    }
  },
  "observations": [
    {
      "kind": "runtime",
      "metrics": [
        {
          "name": "ns_per_element",
          "value": 0.572125435,
          "unit": "ns/element",
          "aggregation": "median",
          "lower": null,
          "upper": null,
          "samples": 15
        },
        {
          "name": "effective_gib_per_second",
          "value": 13.022635,
          "unit": "GiB/s",
          "aggregation": "median",
          "lower": null,
          "upper": null,
          "samples": 15
        },
        {
          "name": "min_ns_per_element",
          "value": 0.489910126,
          "unit": "ns/element",
          "aggregation": "minimum",
          "lower": null,
          "upper": null,
          "samples": 15
        },
        {
          "name": "p95_ns_per_element",
          "value": 0.694830894,
          "unit": "ns/element",
          "aggregation": "p95",
          "lower": null,
          "upper": null,
          "samples": 15
        },
        {
          "name": "mad_ns_per_element",
          "value": 0.064054489,
          "unit": "ns/element",
          "aggregation": "median_absolute_deviation",
          "lower": null,
          "upper": null,
          "samples": 15
        }
      ],
      "measured_iterations": 1024,
      "elements": 1024,
      "bytes_per_iteration": 8192
    },
    {
      "kind": "runtime",
      "metrics": [
        {
          "name": "ns_per_element",
          "value": 0.586192131,
          "unit": "ns/element",
          "aggregation": "median",
          "lower": null,
          "upper": null,
          "samples": 15
        },
        {
          "name": "effective_gib_per_second",
          "value": 12.710134,
          "unit": "GiB/s",
          "aggregation": "median",
          "lower": null,
          "upper": null,
          "samples": 15
        },
        {
          "name": "min_ns_per_element",
          "value": 0.562270164,
          "unit": "ns/element",
          "aggregation": "minimum",
          "lower": null,
          "upper": null,
          "samples": 15
        },
        {
          "name": "p95_ns_per_element",
          "value": 0.675678253,
          "unit": "ns/element",
          "aggregation": "p95",
          "lower": null,
          "upper": null,
          "samples": 15
        },
        {
          "name": "mad_ns_per_element",
          "value": 0.010688782,
          "unit": "ns/element",
          "aggregation": "median_absolute_deviation",
          "lower": null,
          "upper": null,
          "samples": 15
        }
      ],
      "measured_iterations": 128,
      "elements": 8192,
      "bytes_per_iteration": 65536
    },
    {
      "kind": "runtime",
      "metrics": [
        {
          "name": "ns_per_element",
          "value": 0.522613525,
          "unit": "ns/element",
          "aggregation": "median",
          "lower": null,
          "upper": null,
          "samples": 15
        },
        {
          "name": "effective_gib_per_second",
          "value": 14.256387,
          "unit": "GiB/s",
          "aggregation": "median",
          "lower": null,
          "upper": null,
          "samples": 15
        },
        {
          "name": "min_ns_per_element",
          "value": 0.509142876,
          "unit": "ns/element",
          "aggregation": "minimum",
          "lower": null,
          "upper": null,
          "samples": 15
        },
        {
          "name": "p95_ns_per_element",
          "value": 0.560323715,
          "unit": "ns/element",
          "aggregation": "p95",
          "lower": null,
          "upper": null,
          "samples": 15
        },
        {
          "name": "mad_ns_per_element",
          "value": 0.01347065,
          "unit": "ns/element",
          "aggregation": "median_absolute_deviation",
          "lower": null,
          "upper": null,
          "samples": 15
        }
      ],
      "measured_iterations": 16,
      "elements": 65536,
      "bytes_per_iteration": 524288
    },
    {
      "kind": "runtime",
      "metrics": [
        {
          "name": "ns_per_element",
          "value": 0.5126791,
          "unit": "ns/element",
          "aggregation": "median",
          "lower": null,
          "upper": null,
          "samples": 15
        },
        {
          "name": "effective_gib_per_second",
          "value": 14.53264,
          "unit": "GiB/s",
          "aggregation": "median",
          "lower": null,
          "upper": null,
          "samples": 15
        },
        {
          "name": "min_ns_per_element",
          "value": 0.509818077,
          "unit": "ns/element",
          "aggregation": "minimum",
          "lower": null,
          "upper": null,
          "samples": 15
        },
        {
          "name": "p95_ns_per_element",
          "value": 0.531117439,
          "unit": "ns/element",
          "aggregation": "p95",
          "lower": null,
          "upper": null,
          "samples": 15
        },
        {
          "name": "mad_ns_per_element",
          "value": 0.002741814,
          "unit": "ns/element",
          "aggregation": "median_absolute_deviation",
          "lower": null,
          "upper": null,
          "samples": 15
        }
      ],
      "measured_iterations": 4,
      "elements": 262144,
      "bytes_per_iteration": 2097152
    },
    {
      "kind": "runtime",
      "metrics": [
        {
          "name": "ns_per_element",
          "value": 0.522215843,
          "unit": "ns/element",
          "aggregation": "median",
          "lower": null,
          "upper": null,
          "samples": 15
        },
        {
          "name": "effective_gib_per_second",
          "value": 14.267244,
          "unit": "GiB/s",
          "aggregation": "median",
          "lower": null,
          "upper": null,
          "samples": 15
        },
        {
          "name": "min_ns_per_element",
          "value": 0.510215759,
          "unit": "ns/element",
          "aggregation": "minimum",
          "lower": null,
          "upper": null,
          "samples": 15
        },
        {
          "name": "p95_ns_per_element",
          "value": 0.542840004,
          "unit": "ns/element",
          "aggregation": "p95",
          "lower": null,
          "upper": null,
          "samples": 15
        },
        {
          "name": "mad_ns_per_element",
          "value": 0.011721611,
          "unit": "ns/element",
          "aggregation": "median_absolute_deviation",
          "lower": null,
          "upper": null,
          "samples": 15
        }
      ],
      "measured_iterations": 1,
      "elements": 1048576,
      "bytes_per_iteration": 8388608
    },
    {
      "kind": "runtime",
      "metrics": [
        {
          "name": "ns_per_element",
          "value": 0.513762236,
          "unit": "ns/element",
          "aggregation": "median",
          "lower": null,
          "upper": null,
          "samples": 15
        },
        {
          "name": "effective_gib_per_second",
          "value": 14.502001,
          "unit": "GiB/s",
          "aggregation": "median",
          "lower": null,
          "upper": null,
          "samples": 15
        },
        {
          "name": "min_ns_per_element",
          "value": 0.510473967,
          "unit": "ns/element",
          "aggregation": "minimum",
          "lower": null,
          "upper": null,
          "samples": 15
        },
        {
          "name": "p95_ns_per_element",
          "value": 0.528852224,
          "unit": "ns/element",
          "aggregation": "p95",
          "lower": null,
          "upper": null,
          "samples": 15
        },
        {
          "name": "mad_ns_per_element",
          "value": 0.002761602,
          "unit": "ns/element",
          "aggregation": "median_absolute_deviation",
          "lower": null,
          "upper": null,
          "samples": 15
        }
      ],
      "measured_iterations": 1,
      "elements": 4194304,
      "bytes_per_iteration": 33554432
    }
  ],
  "artifacts": [
    {
      "kind": "benchmark-v2",
      "path": "results/artifacts/2026-08-07-baseline/benchmark-v2.json",
      "sha256": "f53e19a13d6f72a9de56c16b23876cd7216e95574ef24a7cc85424488cb89914",
      "description": "Raw samples and toolchain metadata from the same baseline collection."
    }
  ],
  "tags": [
    "benchmark",
    "baseline",
    "rust",
    "squared_error",
    "f64"
  ],
  "notes": "Measured locally on the Darwin arm64 baseline tier. Runtime values are from the preserved benchmark-v2 artifact; the six observations cover the configured size sweep."
}
