{
  "schema": "simd-lab-result-v1",
  "id": "2026-08-07-codegen-x86-64-v3-rust-sat_add-x86-64-v3",
  "created_at": "2026-08-07T02:48:43Z",
  "provenance": {
    "repository": "PlaneSight/rust-zig-cpp-simd-lab",
    "commit": "0055cd3b74017746d501d8973b3441490b154625",
    "branch": "main",
    "workflow_run": "31142383190",
    "source_files": [
      "probes/rust/clamp.rs",
      "probes/rust/sad.rs",
      "probes/rust/sat_add.rs"
    ]
  },
  "environment": {
    "os": "Linux 6.17.0-1020-azure",
    "arch": "x86_64",
    "cpu": "x86-64-v3",
    "cpu_features": [
      "avx2",
      "fma",
      "f16c"
    ],
    "target": "x86_64-unknown-linux-gnu",
    "runner": "github-hosted-ubuntu",
    "virtualized": null
  },
  "toolchain": {
    "language": "rust",
    "compiler": "rustc",
    "version": "rustc 1.97.1 (8bab26f4f 2026-07-14)",
    "optimization": "release",
    "flags": [
      "rustc",
      "--edition=2021",
      "-O",
      "--crate-type=lib",
      "--emit=asm",
      "-C",
      "target-cpu=x86-64-v3",
      "/home/runner/work/rust-zig-cpp-simd-lab/rust-zig-cpp-simd-lab/probes/rust/sat_add.rs",
      "-o",
      "/home/runner/work/rust-zig-cpp-simd-lab/rust-zig-cpp-simd-lab/results/codegen/rust-sat_add-x86-64-v3.s"
    ]
  },
  "experiment": {
    "family": "saturating-arithmetic",
    "kernel": "sat_add_u8",
    "implementation": "probe-aggregate",
    "variant": "scalar-plus-avx2",
    "data_type": "u8",
    "lanes": null,
    "isa": "x86-64-v3",
    "semantics": "exact-u8-saturation",
    "dataset": "codegen-probe-v1",
    "parameters": {
      "metric_source": "rust-sat_add-x86-64-v3.s",
      "target_profile": "x86-64-v3"
    }
  },
  "observations": [
    {
      "kind": "codegen",
      "instruction_count": 223,
      "vector_instruction_count": 37,
      "unique_mnemonics": 34,
      "tracked_mnemonics": {
        "vpaddusb": 11
      },
      "top_mnemonics": {
        "addb": 10,
        "addq": 11,
        "andq": 4,
        "cmovbl": 10,
        "cmpq": 21,
        "jae": 3,
        "je": 10,
        "jmp": 6,
        "jne": 9,
        "leaq": 4,
        "movb": 10,
        "movl": 6,
        "movq": 16,
        "movzbl": 20,
        "setb": 4,
        "subq": 10,
        "vmovdqu": 18,
        "vmovq": 6,
        "vpaddusb": 11,
        "xorl": 7
      },
      "assembly_path": "results/artifacts/2026-08-07-codegen-x86-64-v3/rust-sat_add-x86-64-v3.s.txt",
      "ir_path": null
    },
    {
      "kind": "analysis",
      "summary": "rust x86-64-v3 saturating-add probe tracks 11 VPADDUSB instructions in the aggregate.",
      "severity": "interesting",
      "evidence": [
        "Explicit vector and generic scalar-source lowering are reviewed separately.",
        "Counts include compiler-specific unrolling and residual paths."
      ]
    }
  ],
  "artifacts": [
    {
      "kind": "codegen-manifest",
      "path": "results/codegen/known-good/manifest-x86-64-v3.json",
      "sha256": "10c75969d6bc5d62cf1e62c1892d242387b83c2e7d5cd275a843c0eab68ff0b2",
      "description": "Reviewed x86-64-v3 manifest containing the aggregate metrics referenced by this bundle."
    },
    {
      "kind": "assembly",
      "path": "results/artifacts/2026-08-07-codegen-x86-64-v3/rust-sat_add-x86-64-v3.s.txt",
      "sha256": "169419260a8f5cba42de5221068463b90058d627f3c768cbb28f31f88e3e38f2",
      "description": "Reviewed x86-64-v3 assembly rendered as browser-readable plain text."
    }
  ],
  "tags": [
    "codegen",
    "x86-64-v3",
    "rust",
    "sat_add"
  ],
  "notes": "Browser-visible assembly is preserved as plain text. Metrics are whole-file aggregates for rust-sat_add-x86-64-v3.s; the human review records steady-state and tail interpretation separately."
}
