{
  "schema": "simd-lab-result-v1",
  "id": "2026-08-07-codegen-x86-64-v3-clang-sad-x86-64-v3",
  "created_at": "2026-08-07T02:48:43Z",
  "provenance": {
    "repository": "PlaneSight/rust-zig-cpp-simd-lab",
    "commit": "0055cd3b74017746d501d8973b3441490b154625",
    "branch": "main",
    "workflow_run": "31142383190",
    "source_files": [
      "probes/cpp/clamp.cpp",
      "probes/cpp/sad.cpp",
      "probes/cpp/sat_add.cpp"
    ]
  },
  "environment": {
    "os": "Linux 6.17.0-1020-azure",
    "arch": "x86_64",
    "cpu": "x86-64-v3",
    "cpu_features": [
      "avx2",
      "fma",
      "f16c"
    ],
    "target": "x86_64-unknown-linux-gnu",
    "runner": "github-hosted-ubuntu",
    "virtualized": null
  },
  "toolchain": {
    "language": "cpp",
    "compiler": "clang++",
    "version": "Ubuntu clang version 18.1.3 (1ubuntu1)",
    "optimization": "release",
    "flags": [
      "clang++",
      "-std=c++23",
      "-O3",
      "-S",
      "-masm=intel",
      "-march=x86-64-v3",
      "/home/runner/work/rust-zig-cpp-simd-lab/rust-zig-cpp-simd-lab/probes/cpp/sad.cpp",
      "-o",
      "/home/runner/work/rust-zig-cpp-simd-lab/rust-zig-cpp-simd-lab/results/codegen/clang-sad-x86-64-v3.s"
    ]
  },
  "experiment": {
    "family": "reductions",
    "kernel": "sad_u8",
    "implementation": "probe-aggregate",
    "variant": "scalar-plus-avx2",
    "data_type": "u8",
    "lanes": null,
    "isa": "x86-64-v3",
    "semantics": "exact-integer",
    "dataset": "codegen-probe-v1",
    "parameters": {
      "metric_source": "clang-sad-x86-64-v3.s",
      "target_profile": "x86-64-v3"
    }
  },
  "observations": [
    {
      "kind": "codegen",
      "instruction_count": 199,
      "vector_instruction_count": 107,
      "unique_mnemonics": 37,
      "tracked_mnemonics": {
        "vpadd": 21,
        "vpmin": 4,
        "vpmovsx": 8,
        "vpmovzx": 8,
        "vpsadbw": 9,
        "vpshuf": 3,
        "vpsub": 8
      },
      "top_mnemonics": {
        "add": 9,
        "and": 4,
        "cmp": 11,
        "jae": 4,
        "je": 4,
        "jmp": 4,
        "jne": 7,
        "mov": 13,
        "sub": 6,
        "test": 4,
        "vmovd": 8,
        "vmovdqu": 9,
        "vpaddq": 21,
        "vpcmpeqb": 4,
        "vpminub": 4,
        "vpmovzxbd": 8,
        "vpsadbw": 9,
        "vpsubd": 8,
        "vpxor": 10,
        "xor": 7
      },
      "assembly_path": "results/artifacts/2026-08-07-codegen-x86-64-v3/clang-sad-x86-64-v3.s.txt",
      "ir_path": null
    },
    {
      "kind": "analysis",
      "summary": "clang x86-64-v3 SAD probe tracks 9 VPSADBW instructions in the aggregate.",
      "severity": "interesting",
      "evidence": [
        "Symbol-local review separates steady-state vector loops from scalar or widening tails.",
        "Compiler unrolling accounts for differing VPSADBW counts."
      ]
    }
  ],
  "artifacts": [
    {
      "kind": "codegen-manifest",
      "path": "results/codegen/known-good/manifest-x86-64-v3.json",
      "sha256": "10c75969d6bc5d62cf1e62c1892d242387b83c2e7d5cd275a843c0eab68ff0b2",
      "description": "Reviewed x86-64-v3 manifest containing the aggregate metrics referenced by this bundle."
    },
    {
      "kind": "assembly",
      "path": "results/artifacts/2026-08-07-codegen-x86-64-v3/clang-sad-x86-64-v3.s.txt",
      "sha256": "129916fbeccdece2873c5c9f590eece9f332e5e1383c40493fc3c50bbfd94b3c",
      "description": "Reviewed x86-64-v3 assembly rendered as browser-readable plain text."
    }
  ],
  "tags": [
    "codegen",
    "x86-64-v3",
    "clang",
    "sad"
  ],
  "notes": "Browser-visible assembly is preserved as plain text. Metrics are whole-file aggregates for clang-sad-x86-64-v3.s; the human review records steady-state and tail interpretation separately."
}
