{
  "schema": "simd-lab-result-v1",
  "id": "2026-08-07-codegen-x86-64-v3-gcc-clamp-x86-64-v3",
  "created_at": "2026-08-07T02:48:43Z",
  "provenance": {
    "repository": "PlaneSight/rust-zig-cpp-simd-lab",
    "commit": "0055cd3b74017746d501d8973b3441490b154625",
    "branch": "main",
    "workflow_run": "31142383190",
    "source_files": [
      "probes/cpp/clamp.cpp",
      "probes/cpp/sad.cpp",
      "probes/cpp/sat_add.cpp"
    ]
  },
  "environment": {
    "os": "Linux 6.17.0-1020-azure",
    "arch": "x86_64",
    "cpu": "x86-64-v3",
    "cpu_features": [
      "avx2",
      "fma",
      "f16c"
    ],
    "target": "x86_64-unknown-linux-gnu",
    "runner": "github-hosted-ubuntu",
    "virtualized": null
  },
  "toolchain": {
    "language": "cpp",
    "compiler": "g++",
    "version": "g++ (Ubuntu 13.3.0-6ubuntu2~24.04.1) 13.3.0",
    "optimization": "release",
    "flags": [
      "g++",
      "-std=c++23",
      "-O3",
      "-S",
      "-masm=intel",
      "-march=x86-64-v3",
      "/home/runner/work/rust-zig-cpp-simd-lab/rust-zig-cpp-simd-lab/probes/cpp/clamp.cpp",
      "-o",
      "/home/runner/work/rust-zig-cpp-simd-lab/rust-zig-cpp-simd-lab/results/codegen/gcc-clamp-x86-64-v3.s"
    ]
  },
  "experiment": {
    "family": "min-max-clamp",
    "kernel": "clamp",
    "implementation": "probe-aggregate",
    "variant": "mixed-width-probe",
    "data_type": "mixed",
    "lanes": null,
    "isa": "x86-64-v3",
    "semantics": "min-max-clamp",
    "dataset": "codegen-probe-v1",
    "parameters": {
      "metric_source": "gcc-clamp-x86-64-v3.s",
      "target_profile": "x86-64-v3"
    }
  },
  "observations": [
    {
      "kind": "codegen",
      "instruction_count": 128,
      "vector_instruction_count": 36,
      "unique_mnemonics": 15,
      "tracked_mnemonics": {
        "vmax": 16,
        "vmin": 16
      },
      "top_mnemonics": {
        "cmova": 14,
        "cmovb": 16,
        "cmovbe": 2,
        "cmp": 32,
        "endbr64": 4,
        "mov": 10,
        "movzx": 10,
        "ret": 4,
        "vmaxsd": 8,
        "vmaxss": 8,
        "vminsd": 8,
        "vminss": 8,
        "vmovaps": 1,
        "vmovsd": 2,
        "vmovss": 1
      },
      "assembly_path": "results/codegen/known-good/manifest-x86-64-v3.json#metrics/gcc-clamp-x86-64-v3.s",
      "ir_path": null
    },
    {
      "kind": "analysis",
      "summary": "The x86-64-v3 clamp probe contains integer and f32/f64 paths; this file has no FP16 conversion mnemonics.",
      "severity": "info",
      "evidence": [
        "Reviewed manifest metric source: clamp probe assembly."
      ]
    }
  ],
  "artifacts": [
    {
      "kind": "codegen-manifest",
      "path": "results/codegen/known-good/manifest-x86-64-v3.json",
      "sha256": "10c75969d6bc5d62cf1e62c1892d242387b83c2e7d5cd275a843c0eab68ff0b2",
      "description": "Reviewed x86-64-v3 manifest containing the aggregate metrics referenced by this bundle."
    }
  ],
  "tags": [
    "codegen",
    "x86-64-v3",
    "gcc",
    "clamp"
  ],
  "notes": "Metrics are whole-file aggregates for gcc-clamp-x86-64-v3.s; the human review records steady-state and tail interpretation separately."
}
