{
  "schema": "simd-lab-result-v1",
  "id": "2026-08-07-baseline-zig-clamp-f16-promote-f32",
  "created_at": "2026-08-07T03:28:39Z",
  "provenance": {
    "repository": "PlaneSight/rust-zig-cpp-simd-lab",
    "commit": "ec63b51ecbd9f67b1f93d61f92f40dd1d771df67",
    "branch": "main",
    "workflow_run": null,
    "source_files": [
      "scripts/run_benchmarks.py",
      "zig/src/bench.zig",
      "zig/src/kernels.zig",
      "data/fp16-edge-corpus.json"
    ]
  },
  "environment": {
    "os": "Darwin 25.6.0",
    "arch": "arm64",
    "cpu": "arm",
    "cpu_features": [],
    "target": "aarch64-apple-darwin",
    "runner": "local-macos",
    "virtualized": null
  },
  "toolchain": {
    "language": "zig",
    "compiler": "zig",
    "version": "0.16.0",
    "optimization": "release",
    "flags": [
      "zig",
      "build",
      "bench",
      "-Doptimize=ReleaseFast"
    ]
  },
  "experiment": {
    "family": "min-max-clamp",
    "kernel": "clamp_f16",
    "implementation": "native-vector",
    "variant": "promote-f32",
    "data_type": "f16",
    "lanes": 16,
    "isa": null,
    "semantics": "promote-to-f32-then-narrow",
    "dataset": "deterministic-f16-v1",
    "parameters": {
      "target_tier": "baseline",
      "sample_count": 15,
      "warmup_samples": 3,
      "size_count": 6
    }
  },
  "observations": [
    {
      "kind": "runtime",
      "metrics": [
        {
          "name": "ns_per_element",
          "value": 0.056664467,
          "unit": "ns/element",
          "aggregation": "median",
          "lower": null,
          "upper": null,
          "samples": 15
        },
        {
          "name": "effective_gib_per_second",
          "value": 131.485938,
          "unit": "GiB/s",
          "aggregation": "median",
          "lower": null,
          "upper": null,
          "samples": 15
        },
        {
          "name": "min_ns_per_element",
          "value": 0.056545258,
          "unit": "ns/element",
          "aggregation": "minimum",
          "lower": null,
          "upper": null,
          "samples": 15
        },
        {
          "name": "p95_ns_per_element",
          "value": 0.056743622,
          "unit": "ns/element",
          "aggregation": "p95",
          "lower": null,
          "upper": null,
          "samples": 15
        },
        {
          "name": "mad_ns_per_element",
          "value": 9.54e-07,
          "unit": "ns/element",
          "aggregation": "median_absolute_deviation",
          "lower": null,
          "upper": null,
          "samples": 15
        }
      ],
      "measured_iterations": 1024,
      "elements": 1024,
      "bytes_per_iteration": 8192
    },
    {
      "kind": "runtime",
      "metrics": [
        {
          "name": "ns_per_element",
          "value": 0.045657158,
          "unit": "ns/element",
          "aggregation": "median",
          "lower": null,
          "upper": null,
          "samples": 15
        },
        {
          "name": "effective_gib_per_second",
          "value": 163.185379,
          "unit": "GiB/s",
          "aggregation": "median",
          "lower": null,
          "upper": null,
          "samples": 15
        },
        {
          "name": "min_ns_per_element",
          "value": 0.045577049,
          "unit": "ns/element",
          "aggregation": "minimum",
          "lower": null,
          "upper": null,
          "samples": 15
        },
        {
          "name": "p95_ns_per_element",
          "value": 0.046332359,
          "unit": "ns/element",
          "aggregation": "p95",
          "lower": null,
          "upper": null,
          "samples": 15
        },
        {
          "name": "mad_ns_per_element",
          "value": 4.0054e-05,
          "unit": "ns/element",
          "aggregation": "median_absolute_deviation",
          "lower": null,
          "upper": null,
          "samples": 15
        }
      ],
      "measured_iterations": 128,
      "elements": 8192,
      "bytes_per_iteration": 65536
    },
    {
      "kind": "runtime",
      "metrics": [
        {
          "name": "ns_per_element",
          "value": 0.06135273,
          "unit": "ns/element",
          "aggregation": "median",
          "lower": null,
          "upper": null,
          "samples": 15
        },
        {
          "name": "effective_gib_per_second",
          "value": 121.438453,
          "unit": "GiB/s",
          "aggregation": "median",
          "lower": null,
          "upper": null,
          "samples": 15
        },
        {
          "name": "min_ns_per_element",
          "value": 0.060836792,
          "unit": "ns/element",
          "aggregation": "minimum",
          "lower": null,
          "upper": null,
          "samples": 15
        },
        {
          "name": "p95_ns_per_element",
          "value": 0.064333916,
          "unit": "ns/element",
          "aggregation": "p95",
          "lower": null,
          "upper": null,
          "samples": 15
        },
        {
          "name": "mad_ns_per_element",
          "value": 0.000277519,
          "unit": "ns/element",
          "aggregation": "median_absolute_deviation",
          "lower": null,
          "upper": null,
          "samples": 15
        }
      ],
      "measured_iterations": 16,
      "elements": 65536,
      "bytes_per_iteration": 524288
    },
    {
      "kind": "runtime",
      "metrics": [
        {
          "name": "ns_per_element",
          "value": 0.060756683,
          "unit": "ns/element",
          "aggregation": "median",
          "lower": null,
          "upper": null,
          "samples": 15
        },
        {
          "name": "effective_gib_per_second",
          "value": 122.629811,
          "unit": "GiB/s",
          "aggregation": "median",
          "lower": null,
          "upper": null,
          "samples": 15
        },
        {
          "name": "min_ns_per_element",
          "value": 0.058293343,
          "unit": "ns/element",
          "aggregation": "minimum",
          "lower": null,
          "upper": null,
          "samples": 15
        },
        {
          "name": "p95_ns_per_element",
          "value": 0.062465668,
          "unit": "ns/element",
          "aggregation": "p95",
          "lower": null,
          "upper": null,
          "samples": 15
        },
        {
          "name": "mad_ns_per_element",
          "value": 0.001152992,
          "unit": "ns/element",
          "aggregation": "median_absolute_deviation",
          "lower": null,
          "upper": null,
          "samples": 15
        }
      ],
      "measured_iterations": 4,
      "elements": 262144,
      "bytes_per_iteration": 2097152
    },
    {
      "kind": "runtime",
      "metrics": [
        {
          "name": "ns_per_element",
          "value": 0.064134598,
          "unit": "ns/element",
          "aggregation": "median",
          "lower": null,
          "upper": null,
          "samples": 15
        },
        {
          "name": "effective_gib_per_second",
          "value": 116.171004,
          "unit": "GiB/s",
          "aggregation": "median",
          "lower": null,
          "upper": null,
          "samples": 15
        },
        {
          "name": "min_ns_per_element",
          "value": 0.063100815,
          "unit": "ns/element",
          "aggregation": "minimum",
          "lower": null,
          "upper": null,
          "samples": 15
        },
        {
          "name": "p95_ns_per_element",
          "value": 0.067274094,
          "unit": "ns/element",
          "aggregation": "p95",
          "lower": null,
          "upper": null,
          "samples": 15
        },
        {
          "name": "mad_ns_per_element",
          "value": 0.000953674,
          "unit": "ns/element",
          "aggregation": "median_absolute_deviation",
          "lower": null,
          "upper": null,
          "samples": 15
        }
      ],
      "measured_iterations": 1,
      "elements": 1048576,
      "bytes_per_iteration": 8388608
    },
    {
      "kind": "runtime",
      "metrics": [
        {
          "name": "ns_per_element",
          "value": 0.06583333,
          "unit": "ns/element",
          "aggregation": "median",
          "lower": null,
          "upper": null,
          "samples": 15
        },
        {
          "name": "effective_gib_per_second",
          "value": 113.173382,
          "unit": "GiB/s",
          "aggregation": "median",
          "lower": null,
          "upper": null,
          "samples": 15
        },
        {
          "name": "min_ns_per_element",
          "value": 0.06455183,
          "unit": "ns/element",
          "aggregation": "minimum",
          "lower": null,
          "upper": null,
          "samples": 15
        },
        {
          "name": "p95_ns_per_element",
          "value": 0.090380669,
          "unit": "ns/element",
          "aggregation": "p95",
          "lower": null,
          "upper": null,
          "samples": 15
        },
        {
          "name": "mad_ns_per_element",
          "value": 0.001162291,
          "unit": "ns/element",
          "aggregation": "median_absolute_deviation",
          "lower": null,
          "upper": null,
          "samples": 15
        }
      ],
      "measured_iterations": 1,
      "elements": 4194304,
      "bytes_per_iteration": 33554432
    }
  ],
  "artifacts": [
    {
      "kind": "benchmark-v2",
      "path": "results/artifacts/2026-08-07-baseline/benchmark-v2.json",
      "sha256": "f53e19a13d6f72a9de56c16b23876cd7216e95574ef24a7cc85424488cb89914",
      "description": "Raw samples and toolchain metadata from the same baseline collection."
    }
  ],
  "tags": [
    "benchmark",
    "baseline",
    "zig",
    "clamp_f16",
    "f16"
  ],
  "notes": "Measured locally on the Darwin arm64 baseline tier. Runtime values are from the preserved benchmark-v2 artifact; the six observations cover the configured size sweep."
}
