{
  "schema": "simd-lab-result-v1",
  "id": "2026-08-07-codegen-x86-64-v3-zig-sad-x86-64-v3",
  "created_at": "2026-08-07T02:48:43Z",
  "provenance": {
    "repository": "PlaneSight/rust-zig-cpp-simd-lab",
    "commit": "0055cd3b74017746d501d8973b3441490b154625",
    "branch": "main",
    "workflow_run": "31142383190",
    "source_files": [
      "probes/zig/clamp.zig",
      "probes/zig/sad.zig",
      "probes/zig/sat_add.zig"
    ]
  },
  "environment": {
    "os": "Linux 6.17.0-1020-azure",
    "arch": "x86_64",
    "cpu": "x86-64-v3",
    "cpu_features": [
      "avx2",
      "fma",
      "f16c"
    ],
    "target": "x86_64-unknown-linux-gnu",
    "runner": "github-hosted-ubuntu",
    "virtualized": null
  },
  "toolchain": {
    "language": "zig",
    "compiler": "zig",
    "version": "unavailable",
    "optimization": "ReleaseFast",
    "flags": [
      "zig",
      "build-obj",
      "/home/runner/work/rust-zig-cpp-simd-lab/rust-zig-cpp-simd-lab/probes/zig/sad.zig",
      "-O",
      "ReleaseFast",
      "-mcpu=x86_64_v3",
      "-femit-asm=/home/runner/work/rust-zig-cpp-simd-lab/rust-zig-cpp-simd-lab/results/codegen/zig-sad-x86-64-v3.s",
      "-femit-bin=/home/runner/work/rust-zig-cpp-simd-lab/rust-zig-cpp-simd-lab/results/codegen/zig-sad-x86-64-v3.o"
    ]
  },
  "experiment": {
    "family": "reductions",
    "kernel": "sad_u8",
    "implementation": "probe-aggregate",
    "variant": "scalar-plus-avx2",
    "data_type": "u8",
    "lanes": null,
    "isa": "x86-64-v3",
    "semantics": "exact-integer",
    "dataset": "codegen-probe-v1",
    "parameters": {
      "metric_source": "zig-sad-x86-64-v3.s",
      "target_profile": "x86-64-v3"
    }
  },
  "observations": [
    {
      "kind": "codegen",
      "instruction_count": 29,
      "vector_instruction_count": 14,
      "unique_mnemonics": 18,
      "tracked_mnemonics": {
        "vpadd": 2,
        "vpmax": 1,
        "vpmin": 1,
        "vpmovzx": 2,
        "vpsadbw": 1,
        "vpshuf": 1,
        "vpsub": 1
      },
      "top_mnemonics": {
        "absdiff_u8x32": 1,
        "mov": 3,
        "pop": 3,
        "push": 3,
        "ret": 3,
        "sad_u8x32": 1,
        "vextracti128": 2,
        "vmovd": 1,
        "vmovdqa": 1,
        "vpaddq": 2,
        "vpmaxub": 1,
        "vpminub": 1,
        "vpmovzxbw": 2,
        "vpsadbw": 1,
        "vpshufd": 1,
        "vpsubb": 1,
        "vzeroupper": 1,
        "widen_u8_to_u16x32": 1
      },
      "assembly_path": "results/codegen/known-good/manifest-x86-64-v3.json#metrics/zig-sad-x86-64-v3.s",
      "ir_path": null
    },
    {
      "kind": "analysis",
      "summary": "zig x86-64-v3 SAD probe tracks 1 VPSADBW instructions in the aggregate.",
      "severity": "interesting",
      "evidence": [
        "Symbol-local review separates steady-state vector loops from scalar or widening tails.",
        "Compiler unrolling accounts for differing VPSADBW counts."
      ]
    }
  ],
  "artifacts": [
    {
      "kind": "codegen-manifest",
      "path": "results/codegen/known-good/manifest-x86-64-v3.json",
      "sha256": "10c75969d6bc5d62cf1e62c1892d242387b83c2e7d5cd275a843c0eab68ff0b2",
      "description": "Reviewed x86-64-v3 manifest containing the aggregate metrics referenced by this bundle."
    }
  ],
  "tags": [
    "codegen",
    "x86-64-v3",
    "zig",
    "sad"
  ],
  "notes": "Metrics are whole-file aggregates for zig-sad-x86-64-v3.s; the human review records steady-state and tail interpretation separately."
}
